{
  "schema_version": "1",
  "scenario_id": "scripts-metadata",
  "family": "script-policy",
  "title": "Scripts metadata: startup command, parameters, order, and PowerShell ordering",
  "readiness": "ready",
  "provenance": {
    "tier": "native-observation",
    "note": "R2 native INI captures plus the clean R10 Import-GPO/report/Backup-GPO run establish the Scripts metadata round trip. This remains metadata evidence only; payload execution is outside scope.",
    "anchors": [
      {
        "kind": "native-capture",
        "path": "tests/fixtures/native-scripts-gpmc/scripts.ini.txt",
        "sha256": "12840420c02c5c927d2b6a67d8775b6ea91661bea405a7d74f7532a24b7746f7",
        "note": "Banked native legacy scripts.ini capture."
      },
      {
        "kind": "native-capture",
        "path": "tests/fixtures/native-scripts-gpmc/psscripts.ini.txt",
        "sha256": "169d24b996a7f332c9b67eae177a19fdefc492df4e94cf49caa3659392af881c",
        "note": "Banked native PowerShell scripts.ini capture with RunPSFirst ordering."
      },
      {
        "kind": "lab-runbook",
        "path": "docs/plan-033/wp1b-evidence/scripts-metadata/verification.json",
        "sha256": "0349e7d365e7a2e9ed24d029e72faf88636a7ee0ddbb212a9c072da259ebad49",
        "note": "Clean R10 re-run passed 21/21 checks, re-earning the binding after export.py gained extension_registration (WI-057)."
      }
    ]
  },
  "platform": {
    "lane": "scripts-metadata-gpmc",
    "boundaries": [
      "gpo-backup-content"
    ]
  },
  "authored_intent": {
    "entries": [
      {
        "side": "computer",
        "type": "startup",
        "command": "zz-studio-marker.cmd",
        "parameters": "/c alpha beta",
        "order": 1
      },
      {
        "side": "computer",
        "type": "startup",
        "command": "zz-studio-second.cmd",
        "parameters": null,
        "order": 2
      },
      {
        "side": "computer",
        "type": "startup",
        "command": "zz-studio-marker.ps1",
        "parameters": "-Mode Alpha",
        "order": 0,
        "run_order": "RunPSFirst"
      }
    ]
  },
  "expected_native": {
    "round_trip": "import-gpo-report-backup-gpo",
    "entries": [
      {
        "side": "computer",
        "type": "startup",
        "command": "zz-studio-marker.cmd",
        "parameters": "/c alpha beta",
        "order": 1,
        "run_order": "RunPSFirst"
      },
      {
        "side": "computer",
        "type": "startup",
        "command": "zz-studio-second.cmd",
        "parameters": null,
        "order": 2,
        "run_order": "RunPSFirst"
      },
      {
        "side": "computer",
        "type": "startup",
        "command": "zz-studio-marker.ps1",
        "parameters": "-Mode Alpha",
        "order": 0,
        "run_order": "RunPSFirst"
      }
    ],
    "derivations": [
      "Native legacy scripts.ini is UTF-16LE with BOM and CRLF and carries the two command entries with their parameter positions.",
      "Native psscripts.ini carries StartExecutePSFirst=true and the PowerShell startup entry.",
      "This scenario asserts metadata import/render/rebackup only; script payload execution and endpoint policy processing are outside scope."
    ]
  },
  "open_questions": [
    "Does the imported metadata remain editable in the GPMC GUI?",
    "How are executable payloads delivered and processed at endpoints?",
    "Do user-side scripts and other ordering combinations retain their metadata through the same round trip?"
  ]
}
