{
  "schema_version": "1",
  "scenario_id": "reader-no-silent-drop",
  "family": "gpp-services",
  "title": "Importing the native services capture must not silently discard recovery semantics",
  "readiness": "ready",
  "work_items": ["WI-022"],
  "provenance": {
    "tier": "native-observation",
    "note": "Anchored to the same genuine GPMC capture as native-recovery-units. The expected behavior is stated against Studio's public parse path (parse_gpp_services via the backup importer), which an operator actually runs; TestWi022ServicesConformance now pins the corrected behavior locally.",
    "anchors": [
      {
        "kind": "native-capture",
        "path": "tests/fixtures/native-gpp-gpmc/WI01A-Services-GPMC/{BFC38120-130B-43A1-AB13-80D3A4D0E6C1}/DomainSysvol/GPO/Machine/Preferences/Services/Services.xml",
        "sha256": "28b30cbb78565db4f837564c5c9d3e5f4517b0f1c53aeedea44ab84106461221"
      }
    ]
  },
  "platform": {
    "lane": "gpp-reader-native",
    "boundaries": ["gpo-backup-content"]
  },
  "authored_intent": {
    "operator_action": "Import the committed WI01A-Services-GPMC backup through Studio's backup-import path and inspect the resulting services items.",
    "items": [
      {"service_name": "WinRM"},
      {"service_name": "Spooler"},
      {"service_name": "W32Time"}
    ]
  },
  "expected_native": {
    "import_must_succeed": true,
    "item_count": 3,
    "items": [
      {
        "service_name": "WinRM",
        "must_represent": {
          "startup_type": "no_change",
          "service_action": "start",
          "timeout_seconds": 30,
          "first_failure": "restart",
          "second_failure": "restart",
          "third_failure": "restart",
          "reset_fail_count_delay_seconds": 0,
          "restart_service_delay_raw": "60000000"
        }
      },
      {
        "service_name": "Spooler",
        "must_represent": {
          "startup_type": "automatic",
          "service_action": "restart",
          "timeout_seconds": 60,
          "first_failure": "restart",
          "second_failure": "restart",
          "reset_fail_count_delay_seconds": 86400,
          "restart_service_delay_raw": "30000000"
        }
      },
      {
        "service_name": "W32Time",
        "must_represent": {
          "startup_type": "no_change",
          "service_action": "stop",
          "timeout_seconds": 30
        }
      }
    ],
    "loss_policy": "Every recovery attribute present in the capture must surface in the Studio model either as a typed field or as preserved unknown content that a later export re-emits. A value that vanishes at parse time and is absent from any re-export is a silent drop and fails this scenario; it is the reader-side half of WI-022. Attributes GPMC itself omitted (Spooler thirdFailure, W32Time recovery set) must remain absent, not materialize as defaults on re-export."
  },
  "open_questions": []
}
